{
  "schema_version": "jury.package_release_archive_manifest.v1",
  "package": "@sanogueralorenzo/jury",
  "failed": {
    "packageVersion": "0.1.0",
    "tarballName": "sanogueralorenzo-jury-0.1.0.tgz",
    "dryRunRecord": "jury-pack-dry-run-record.json",
    "npmView": "failed-npm-view.json",
    "downstreamGate": "downstream-failure-gate.json",
    "rollbackAudit": "rollback-audit.json",
    "deprecation": {
      "attempted": true,
      "allowed": true,
      "command": "npm deprecate @sanogueralorenzo/jury@0.1.0 \"Downstream Jury verification failed; use a later patch release.\"",
      "result": "failed version points consumers to a later patch release"
    }
  },
  "replacement": {
    "packageVersion": "0.1.1",
    "npmView": "replacement-npm-view.json",
    "distTarball": "https://registry.npmjs.org/@sanogueralorenzo/jury/-/sanogueralorenzo-jury-0.1.1.tgz",
    "downstreamGate": "replacement-downstream-gate.json",
    "replacementAudit": "replacement-patch-audit.json"
  },
  "retention": {
    "policy": "jury.package_release_retention.v1",
    "storage": "release record or incident archive",
    "retainUntil": "180 days after replacement downstream verification passes",
    "artifacts": [
      "jury-package-dry-run",
      "jury-package-release-evidence",
      "jury-package-release-replay-summary",
      "jury-pack-dry-run-record.json",
      "failed-npm-view.json",
      "downstream-failure-gate.json",
      "rollback-audit.json",
      "jury-package-release-replay-summary.md",
      "jury-package-release-replay-summary-diagnostics.json",
      "jury-package-release-replay-summary-diagnostics-retention-handoff.json",
      "archive-drift-remediation-audit.json",
      "archive-drift-remediation-audit-handoff.json",
      "GITHUB_STEP_SUMMARY",
      "replacement-npm-view.json",
      "replacement-downstream-gate.json",
      "replacement-patch-audit.json"
    ]
  },
  "provenance": {
    "source": "github-actions",
    "workflow": "jury-npm-publish.yml",
    "runId": "example-release-run-1001",
    "sourceRevision": "example-release-revision",
    "artifacts": [
      {
        "name": "jury-package-dry-run",
        "sourceJob": "dry-run-publication",
        "retentionDays": 90,
        "files": [
          "jury-pack-dry-run.json",
          "jury-pack-dry-run-record.json"
        ]
      },
      {
        "name": "jury-package-release-evidence",
        "sourceJob": "package-release-fixtures",
        "retentionDays": 90,
        "files": [
          "README.md",
          "jury-pack-dry-run-record.json",
          "failed-npm-view.json",
          "downstream-failure-gate.json",
          "rollback-audit.json",
          "replacement-npm-view.json",
          "replacement-downstream-gate.json",
          "replacement-patch-audit.json",
          "archive-drift-remediation-audit.json",
          "archive-drift-remediation-audit-handoff.json",
          "jury-package-release-replay-summary.md",
          "jury-package-release-replay-summary-diagnostics.json",
          "jury-package-release-replay-summary-diagnostics-retention-handoff.json"
        ]
      },
      {
        "name": "jury-package-release-replay-summary",
        "sourceJob": "package-release-evidence-replay",
        "retentionDays": 90,
        "files": [
          "jury-package-release-replay-summary.md",
          "jury-package-release-replay-summary-diagnostics.json",
          "jury-package-release-replay-summary-diagnostics-retention-handoff.json"
        ]
      }
    ]
  },
  "archiveEvidence": [
    {
      "path": "jury-pack-dry-run-record.json",
      "sha256": "sha256:98c1435b0ae0d3839bbdaf23a95078e4288c3d29853bd9c2d35a4301abf8df51"
    },
    {
      "path": "failed-npm-view.json",
      "sha256": "sha256:cacaef42592ec152da581a7295f923da0a6f7ec4a9637a40b69fa74bc9b001b5"
    },
    {
      "path": "downstream-failure-gate.json",
      "sha256": "sha256:1bdc93cc74b9b062859363e3770a4d01a1c8db8874da10211046f59aba06b239"
    },
    {
      "path": "rollback-audit.json",
      "sha256": "sha256:c66c2a78bfc7ea7459962d0f7b6f8306146122de16be80847239fcd03802f3ef"
    },
    {
      "path": "replacement-npm-view.json",
      "sha256": "sha256:aaa6629186e307263f617e440f40b5de8de5be5f916da9ba3971db890f08a664"
    },
    {
      "path": "replacement-downstream-gate.json",
      "sha256": "sha256:8b12bc003be9b3e8dcb1d01ed562dbddffeb6868ce14972ba780ef53d10e1247"
    },
    {
      "path": "replacement-patch-audit.json",
      "sha256": "sha256:24df732d890f493eeb28187f711637f243edc2b47761751fb2e872d2c6bd4a59"
    },
    {
      "path": "archive-drift-remediation-audit.json",
      "sha256": "sha256:604acf2a197e20a55b561dabc3244b4799ec56f9f2e859ca45c8ba7431ae4766"
    },
    {
      "path": "archive-drift-remediation-audit-handoff.json",
      "sha256": "sha256:f3d0f99c597c89195c4a20fed7c4be218f30e17561180bc399ed039b6f412318"
    },
    {
      "path": "jury-package-release-replay-summary.md",
      "sha256": "sha256:66ef94dd3513c21c79f5aeca2362a4bc312fe9955fd47e188b1f2cd37edf258f"
    },
    {
      "path": "jury-package-release-replay-summary-diagnostics.json",
      "sha256": "sha256:9872fa21227f9a1d272d4168583b6b0061c36bcf4631bbe35ef095c9b6480d9e"
    },
    {
      "path": "jury-package-release-replay-summary-diagnostics-retention-handoff.json",
      "sha256": "sha256:97c558de59e68091daa55f5666f16c2fbd15962da2580755b2bad8ccc58b5e7a"
    }
  ]
}
